{
  "$schema": "./schemas/workspace-model-snapshot.schema.json",
  "workspace_id": "workflow-cookbook-main",
  "constraints": {
    "allowed_tools": ["Bash", "Edit", "Read", "Write", "Glob", "Grep"],
    "restricted_tools": [],
    "allowed_paths": ["docs/", "tools/", "tests/", ".github/"],
    "restricted_paths": ["secrets/", ".env"],
    "max_file_size_mb": 10,
    "require_branch_prefix": "feature/",
    "require_pr_template": true,
    "forbidden_file_patterns": ["*.pem", "*.key", "*.secret"],
    "ci_phase": "phase3"
  },
  "preferred_docs": [
    {
      "doc_id": "RUNBOOK.md",
      "priority": 1,
      "reason": "実行手順入口",
      "category": "runbook"
    },
    {
      "doc_id": "docs/spec.md",
      "priority": 2,
      "reason": "仕様正本",
      "category": "spec"
    },
    {
      "doc_id": "docs/requirements.md",
      "priority": 3,
      "reason": "要件正本",
      "category": "requirements"
    },
    {
      "doc_id": "docs/CONTRACTS.md",
      "priority": 4,
      "reason": "外部契約",
      "category": "contract"
    }
  ],
  "repo_notes": [
    {
      "repo": "workflow-cookbook",
      "note": "coverage下限80%、pytest必須",
      "category": "testing"
    },
    {
      "repo": "workflow-cookbook",
      "note": "branch protection有効、7 required checks",
      "category": "security"
    }
  ],
  "common_runbooks": [
    {
      "runbook_id": "RUNBOOK.md#execute",
      "usage_frequency": "daily",
      "last_used_at": "2026-05-03T00:00:00Z"
    },
    {
      "runbook_id": "RUNBOOK.md#rollback",
      "usage_frequency": "occasional",
      "last_used_at": "2026-04-19T11:15:00Z"
    }
  ],
  "reviewed_at": "2026-05-03T00:00:00Z",
  "reviewer": "docs-core",
  "review_state": "approved",
  "created_at": "2026-05-02T12:00:00Z",
  "updated_at": "2026-05-03T00:00:00Z",
  "schema_version": "1.0.0"
}